"Comment ID","Timestamp GMT",Author,"Author email","Author URL",Type,Parent,Comment
85,2007-03-17T11:48:00+00:00,Anonymous,,,comment,0,"I got here through typing ‘fuck firefox’ because I really don’t get it. I have loads of friends that convinced me somehow to download firefox even though I haven’t ever really had a problem with IE. I downloaded it and it really isn’t any better, worst of all is that I keep having to install new plug ins and anything windows media based will not work for shit.

I just think it’s all in the same with firefox users, they are trying to give two fingers to gates et all at microsoft just because they are the monopoly. Well there is a reason they are the monopoly and it’s generally because their software is pretty good at it’s job and has created standards across the pc platform. It allows for multiple programs to work together as if they were a suite. Why try and stick two fingers to a company that keeps your computer cohesive and easy to run?

As for people saying firefox doesn’t display websites because their code is shit is also a load of bollocks. I programmed a tentative html 1.0 website, the oldest type possible, tested perfectly for errors which displayed fine in IE 6 / 7 and Opera 9 but fucked up in firefox. Now I’m not anal enough to find out why firefox thinks my website should be rammed into the far left corner, but it pissed me off.

However dispite this, I am in favour of firefox’s existence because mozilla have helped microsoft finally fix a few niggles since IE 5, especially within security and the tabbed browsing can be useful for just clicking to view a picture or something."
86,2007-04-07T17:38:00+00:00,Anonymous,,,comment,0,"Why the hell would you want to uninstall IE? It’s part of explorer you know. You’ll just break Windows. It’s a sick notion conjured up by militant anti-MS idiots.  
Just go to the control panel, choose “Add/Remove Programs”, choose “Add/Remove Windows Components”, uncheck IE, press “Done”.  
And IE will never bother you again.

I got here too by searching for Fuck Firefox. Not because it’s bad, it’s a decent browser.

But because 90% of its userbase are a bunch of whiny, arrogant, elitist fuckheads. I have unjustly been bitten in the ass several times, once I was litterally told to go to hell because of my browser choice. Something I won’t tolerate.

Luckily I happen to know one of the 10% people who just got it for the shiny logo and the “security-by-obscurity” syndrome.

I will put up with wierd-looking websites because of bad web interpretation, but not with the obnoxious “campaign”, or rather crusade that Open Source extremists are leading, complete with verbal rapings and pillages.

Finally, it’s interesting to note for those “standards” wierdo’s that IE and Firefox are the only two of the major browsers wich are not compliant.  
And in what world did you imagine that Firefox was safe? The only reason it has not yet been fucked over by hackers and worm makers is its lack of market dominance.  
The only thing that speaks for that argument is the somewhat faster hole closing practice."
87,2007-04-10T19:33:00+00:00,Anonymous,,,comment,0,"FACT: If you don’t use Firefox, you’re a moron who needs to die."
88,2007-04-11T09:10:00+00:00,PO'd_User,,,comment,0,"I got here typing in “fuck linux” because Im pissed at te os. tried installing ubuntu the past 3 days to no avail read hundreds of articles on the subject entering gay ass commands to try and help using different cds and versions of the os.  
just wanted to learn perl better. is that so fucking hard?"
89,2007-04-12T11:51:00+00:00,asserman,,,comment,0,"I would have to concur that the process to remove/decline the use of IE is particularly difficult. Saying that, it is hard to find compelling reasons to make a switch. It all works, its all stable, and whatever modicum of benefit is to be gleaned is hardly worth the trouble.

Any if you don’t agree with that, you can go and fuck your mothers."
90,2007-04-25T04:42:00+00:00,Anonymous,,,comment,0,"I got here by typing “fuck google” actually xD"
91,2007-04-30T14:50:00+00:00,Anonymous,,,comment,0,"Hey! I was sitting here masterbating to my firefox logos and decided to type google fuck into googles search box! I am here now, awesome.

Just so everyone else knows windizupdate.com is a firefox compatible windows update. It’s awesome too. I am so awesome."
92,2007-05-03T21:02:00+00:00,Anonymous,,,comment,0,"ie is better than ff, the facts just constantly point it out. I really just don’t understand why people keep defending either one. I’ve used about 6 different browsers on windows, 3 on linux, and 3 on mac, and all of them were shit. why do people constantly try to defend piles of shit.

<http://mywebpages.comcast.net/>  
SupportCD/FirefoxMyths.html

I got here with ‘fuck fanboys’"
93,2007-05-06T19:23:00+00:00,Anonymous,,,comment,0,"Fuck Linux,  
That’s the keyword i typed on google.  
Been hours searching for 1 single configuration changing resolution in Ubuntu linux Widescreen mode using NVIDIA. Still couldn’t get it right. Maybe it takes me less that 3 second to change the resolution in Windows to whatever resolution you want.  
Just testing a linux OS, picked Distro Ubuntu to get into Linux, but this is what i got, still learing though, I was wondering if Linux replacing Windows, i’m talking about a regular user here, ask them to install flash player for example in Ubuntu. Yeah, right! Tell them to download the file, extract here, which i doubt they would know how to do it, run a couple command line in the terminal linux, and make it running. Hah!"
94,2007-05-22T20:26:00+00:00,Anonymous,,,comment,0,"since firebug and the web developer tool came to firefox i converted as a web developer i believe IE is no match for firefox.

For all the people who are complaining about their websites not looking good in firefox, do the following:

a) learn CSS  
b) start building standard compliant websites.

There is a crashing issue which pisses me off about firefox. So i use explorer sometimes. No problem. Have both browsers each has its unique strenghts.

Thanks"
95,2007-05-27T19:01:00+00:00,"Scott Lloyd",,,comment,0,"More secure and faster my ass. Firefox is a mess. Don’t believe all that open source FUD."
96,2007-05-31T16:40:00+00:00,tanguy:r,,,comment,0,"drop her."
97,2007-06-03T12:49:00+00:00,Adam,,,comment,0,"Im another “fuck firefox” google searcher. Fanboys piss me off too. Seems to be the same people that would get all defensive about the wii compared to real games consoles. The losers pride themselves on firefox,linux,and the mighty wii!!!

PS fuck Macs too!

IE is fine and windows does its job."
98,2007-06-11T19:09:00+00:00,amber,,,comment,0,"Pete said…

 I’m sure FireFux is a safer browser that IE, of that I have no doubt.

 But why? Because hackers don’t waste their time on browsers no-one uses.

 2:36 PM, August 16, 2006

\_\_\_\_\_\_\_\_\_\_\_\_\_\_\_\_

The reason why hackers don’t mess with Firefox is because it isn’t a Microsoft product. Hackers hack Microsoft products like Internet Explorer and Windows to make a point, that they are vulnerable and insecure. It’s to make people realize this and hopefully they would switch from what’s considered to be the Evil Money-Hungry Monopolizong Empire known as Microsoft.

It had nothing to do with because it wasn’t used as much.  
Just like some people “hack” people’s wireless connections and “take them over” and *some* people “hack” other people’s websites follows the same reasoning why hackers originally started hacking Microsoft products – to prove a point – that it’s insecure and vulnerable.  
Another reason hackers always favored linux and firefox and targeted Microsoft products was Microsoft has a bad image and reputation with the open-source communities. It was to help drive them away from what was/is considered to be a “money-hungry, monopolizing, unsecure and vulnerable, evil empire”.

I agree with them all the way.

Microsoft has always been monopolizing. With browsers like Netscape they weren’t willing to compromise or agree, with Sun Java, etc.   
Even with Vista, the software and hardware companies had begun making drivers for the new OS and what did they do? At the last minute, completely changed the code and that’s one reason why there still isn’t that many drivers that are ready for Vista when it came out.   
Why’d they do it? Most likely because it got “hacked” and they wanted to try to throw the “hackers” off by writing up some new code.   
As if it was going to stop them…. IT’S TEXT, FFS!  
Microsoft completely screwed the customers who DO pay for the OS, because they didn’t have drivers for the new software they paid $400+ for. People paid $400+ and still continue to do so, for what? To be beta-testers for something Microsoft claim to be “releaseable”.  
It’s crap wrapped in pretty wrapping.  
They couldn’t give a damn about the people they need to be keeping happy – their paying customers.  
Now because they’re fighting some hackers that want to make MS Windows freely available to test before people get suckered into paying for some junk that even paying customers had bought and RETURNED and have actually turned some old Windows users into Linux users (me for one),  
continuing on… because they’re more concerned about their money and fighting the hackers, they’re making their paying customers suffer because:  
1\. Those customers have a new junk OS they paid for that has/had very few drivers for it. All the hardware and software that their paying customers paid for that was supposed to be “Vista Ready/Compatible” wasn’t/isn’t. But it was MS’s fault, not the hardware/software companies.  
2\. Paying customers have to go through hell to activate their products now.  
3\. When their paying customers had to reformat the junk OS’s too many times, they had to go through hell to get it reinstalled because the software wouldn’t let them! So they would have to call up customer support to get it reinstalled!   
If anyone remembers correctly, a lot of those people that had to, commented on how they were treated like criminals over the phone because they weren’t believed that they had actually paid for it! Customer service treated them as if they had “stolen” the software.  
Not to mention the “Is Your Copy of Windows Genuine?” button on the top of every directory of PAID FOR XP INSTALLATIONS!

And they sure as hell aren’t going to let you leave. They’re going to keep you relying on the only software they make available at installation… theirs.  
DirectX, .pst’s, Microsoft Media Player, Internet Explorer. I still haven’t been able to break completely away yet, because all my hardware me and my husband spent hundredsd of dollars on are all Windows-based! I still haven’t had a chance to convert my .pst files to be able to access my email because most programs, if I use it to convert them, I’ll lose a vital portion of my data!  
I can’t tell you how much money I’ve lost and how many hours have been wasted creating important documents that got wiped out by bluescreens!  
Thanks Microsoft!

Amen to the hackers!

I’d rather try the crap they’re pumping out to people, before spending that much money on it. Especially to have to go through the hell paying customers do, which I have been one of them. I even bought XP 3 times!  
But the average person cannot spend 400+ on an OS, plus buy all the software that makes a system worthwhile and to keep it clean, secure and bug-free.  
If it wasn’t for me, my mother would still be stuck with Windows 95!   
Does Microsoft care? Hell no.  
But the great open-source and Linux hackers do. They care enough to spend their free time and resources creating and updating great OS’s that are unbelievably secure and stable compared to Windows and that aren’t being attacked by hackers because those hackers aren’t going to attack “the cause” – which is an excellent one.

Many people are reluctant to switch when IE is all they’ve ever known. Some people just don’t want to install “extra” software when IE already comes packaged.  
I have never told someone else what browser they should use but god knows how many times I’ve had people bash products that have been nothing but good and extremely useful to me and they expect me not to say anything back about it?

The only thing that IE has going for it is it’s the only piece of software on the OS that’s “stable”, relativly speaking.  
Otherwise, truth is, it’s vulnerable and unsecure, as “hackers” have proven time and time again. The webpages ONLY come out right on IE and not any other browsers because they’re the only ones screwing up the specifications. They even admitted to having screwed up the specifications and people have known that there were all types of web coding issues with IE  
<http://blogs.msdn.com/ie/archive/2005/07/29/445242.aspx>  
You could make a page look great in all the browsers, but IE would be the only one with issues. You could make a page look great in IE, but it would look horrible in all the others. Many others can’t be wrong.  
There are also many great features in Firefox (and other browsers) that aren’t in IE, like tabbed browsing that IE has JUST implemented when they realized how many people found great use for it. Many things that IE has just considered doing because everyone else has done them and the new features have turned out to be a big hit! IE is just a follower browser.  
There are many reasons that make Firefox and other browsers superior to IE. Nobody is bashing “you”, we’re making valid points to the browser and no matter how hard you hate to admit it, you know the points made are true, most of them anyway, I have seen people exaggerate at times.  
I’ve had my own issues with Firefox. There was a time that it overwrote all my settings when it updated, there was a time that it would take 2 minutes+ to load a page (but reinstalling it sorted that. I had it installed for several months and installed quite a few extensions), I’ve had quite a few times when I had a few choice words for Firefox, but even so, compared to IE, no matter how upset I was with Firefox, I cannot stand here and deny the fact that it’s superior to IE. From the coing standards to the great features to the security of it, I can’t deny that.   
With any software that gets updated, you’re going to have issues time to time, but IE has a problem with letting their issues regardless of if the user sees it or not, they have a problem with letting the issue go on for ages before doing something about it.

Anyway, I’m quite happy with my system that is stable and dependable. I know that if I leave a file unsaved overnight, the next mnorning, it will  
still be there. No freezes, no bluescreens. I don’t need to spend any money to have something “decent” (my choice word – excellent). No spyware/adware, virus protection and firewall protection software needed. I don’t need to buy Microsoft Office just so I can have a decent text editor than notepad. The list goes on and on.  
Linux provides me with all the types of software and even games that you can get with Windows and so much more, with the same features and even more of them, and at what cost?   
Need support? I get that too, all free. There’s TONS of info on Linux all over Google and many other places. Go into the linux forums and there’s many great, friendly linux users willing to help you sort out any problem or question you might have.

Microsoft, with all that money they’ve been making – you think they would have kept up with and updated their browser to be something great but all that time it was the free browsers that were listening to their userbase and keeping up with the W3C web standards, guidelines and specifications and acting on it, always doing something about it and keeping it updated and something that their users wanted.   
To all the open-source developers and the users of those products that give them a reason to keep at it – I for one, thank you from the bottom of my heart. You all will always have my most sincere gratitude and support.

amb."
99,2007-06-19T17:52:00+00:00,Teemu,,,comment,0,"I suppose Linux wouldn’t rule so much if more people would be using it, eh? 😉"
100,2007-06-21T00:19:00+00:00,Anonymous,,,comment,0,"Firefox and IE both suck, use Safari."
101,2007-07-03T19:46:00+00:00,Anonymous,,,comment,0,"i cant stand windows ballons poopping up all over the place i,ve never used linux but i curse windows everytime i uses it  
and i would never dream of using i e-  
stuff microsoft its about time somebody came up with a good no frills basic operaring system with an extensive range of drivers for all hardware and windows dissapearedoff the planet!!!!"
102,2007-07-06T03:33:00+00:00,Niko14,,,comment,0,"i too found this page by searching ‘fuck linux’.

I honestly cant be fucked with it. I like things that work when you want to use them. IF I HAVE TO TYPE ONE MORE LINE OF CODE I SWEAR I’M GONNA WALK INTO MCDONALDS WITH AN UZI!!!

Heck while i’m at it:

FUCK MICROSHIT for making a more expensive just as crap product and…

FUCK LINUX NERDS who all have IQ’s of 160 but can’t make a single decent userfriendly os.

I’m just gonna buy a goddam mac.

…I hate you"
103,2007-07-18T03:08:00+00:00,"Jason (Jay) R Fink",,,comment,0,"I found this posting a bit late but thought I would toss in a comment about someone else’s comment. A poster claimed that the network connection plus system speed are the only pieces of the formula regarding speed; that is completely wrong. The rendering engine plus http method of the browser client has a tremendous impact on speed.

IE3 for instance loaded pages initially far quicker than Netscape did at the time (or Nutscrape as I like to call it). Same connection, same computer. Netscape, however, traversed faster than IE3 once it was up and running.

Firefox (generally) renders faster than IE does now simply due to less bloat – the tradeoff is manual installation of many plugins.

It is quite possible (probable?) that IE will be slimmed down in the future (or perhaps a faster browser product from Microsoft) will come about and the cycle will just rinse and repeat like any other technology."
104,2007-07-18T10:57:00+00:00,Anonymous,,,comment,0,"Fuck Firefox and it’s fucking fanbois! Fuck Neowin!!!"
105,2007-07-18T23:13:00+00:00,Anonymous,,,comment,0,"I also got here by typing “Fuck Firefox”, but on the firefox homepage search function..

IE is an unstable piece of shit… but firefox, although being much more stable, doesnt work so well. Some pages dont open, some pages look messed up…

I hate IE due to the bad experiences i’ve had with it, but i won’t go all frothed up in my mouth, wearing a mozilla shirt, and say Firefox is better. It’s shit too…"
106,2007-07-24T04:32:00+00:00,PastorVor,,,comment,0,"Looks like you are getting quite a few “fuck firefox” postings so here is mine.

I got this page by typing:  
“where the fuck is my old HOME PAGE??? If Firefox keeps doing this I’m gonna switch back!!!!!!!”  
into the generic Firefox/google homepage that Firefox insists in replacing my OWN homepage with whenever I update.  
Ordinarily this wouldn’t be such a problem but the last upgrade (which was a full Firefox download) actually deleted/lost all of my favorites and bookmarks.

Don’t get me wrong, I like Firefox and I hate IE but I still use IE for many things and I have never had a problem working on a system that had IE as the default browser.  
Is one better than the other? Who cares? The better question should be: Does it do what you need it to do? Both Firefox and IE work just fine.  
I don’t get any more virus’s from IE than I do in Firefox.. (zero in both, although my “Avast” virus software has caught a few things from time to time.  
Right now my IE is refusing to update due to some past update not installing correctly… (an issue which Windows seems to not give a shit about) so I don’t have the latest IE and I don’t really care. My firefox works fine.  
If only I could get it to quit changing my god damn home page!!!

Rant over…  
Party on Garth"
107,2007-08-20T08:58:00+00:00,Endre,,,comment,0,"I also got here by typing “fuck firefox” in google.

xhtml standards and such, given firefox and \*cough\* opera, you have to take double the time to develop a web page just because after you make it work with IE – you have to spend some more time making it work with firefox, regardless of standards or not, IE being the most used browser, you want your site to be perfect with it. Another thing that firefox sucks with is its javascript, standards or not, ie’s DOM has more methods that are actually useful whereas with firefox you have to scan the whole DOM tree to get an element’s relative position to its parent.

As for Linux vs. Windows – nothing to argue about there, anyone who does is an idiot: You use windoze to play / work, and you use Linux TO RUN FUCKING WEBSERVERS AND SUCH (web, database, dns, routing etc). you do not run services on windows (be it 2003 server) because that sucks."
108,2007-08-20T09:07:00+00:00,endre,,,comment,0,"and as for mac fans from this page:  
 did you know the joke when the mac asks the pc:

mac: Whatcha doin, PC?  
pc: I’m playing this new game.  
mac: Oh really, which one?  
pc: Any.

or, this one:

mac: Whatcha doin, PC?  
pc: Getting a videocard upgrade."
109,2007-08-20T10:10:00+00:00,Joe,,,comment,0,"Well, i did not get here by typing “fuck firefox” in google, i got here because my friend typed “fuck firefox” in google.

All I want to say is that I hate Firefox with all my heart and I really don’t get those who like it (specially those who like it over IE7) and try to convince others to use it too.

I’m a website developer and just because of firefox I have to spend twice as much time on making a website work with firefox than it would take to make the whole fucking site.

Someone before me posted about standards and poor programming. I agree, programmers should follow standards, but the thing is that even if you follow standards or not with Internet Explorer the result is the same while firefox fucks it all up.

I’m sick and tired of it and from some time now i don’t even give a rats ass on how would it look with firefox. I simply ignore it.

From the website developers point of view firefox is a nightmare and i don’t see how could that be any different from any other point of view.

I could go on with the pro’s and con’s but i really don’t feel the need to. My websites logs say it all!!

70% of the users\* use IE and only 26% use FireFox  
The remaining 4% are mostly Opera users or other linux based browsers.

So, if you’re not sure what to use or which it better just ask yourself “why only 26% of users\* uses FireFox?”

\*users on websites hosted on my server"
110,2007-08-25T03:36:00+00:00,Anonymous,,,comment,0,"TROLLS ASSEMBLY DETECTED."
