"Comment ID","Timestamp GMT",Author,"Author email","Author URL",Type,Parent,Comment
45,2004-07-01T14:29:00+00:00,Jim,,,comment,0,"Given that uninstalling IE is a nightmare, I’ve found that deleting all the obvious shortcuts to IE and making Moz the default browser works tolerably well.

There’s probably a dll that only IE depends on that would stop IE from working, nuking just that would be a simple way of hamstringing IE 🙂"
46,2004-07-01T16:24:00+00:00,Pip,,,comment,0,"Are you kidding? I value my life! 🙂"
47,2004-07-08T16:43:00+00:00,UnrulyGrrl,,,comment,0,"*we’re using Windows XP at home*This is why you NEVER EVER share a computer with your significant other. Ever. Then they can have the “freedom” to be shackled to an inferior OS.

*if only I could uninstall IE.*Try renaming iexplore.exe. Then say “Hmm, IE isnt working. Maybe now’s a good time for you to try Firefox hon!”

Tabs. hello. Reason #1 to ditch IE and go with Firefox"
48,2006-02-10T23:04:00+00:00,Mitchell,,,comment,0,"Your girlfriend is smart.

Fuck Firefox and every Firefox fanboi\* that thinks having firefox make them “different”.

You all claim Firefox is faster, more secure, but these two notions are IMPOSSIBLE. Your connection speed NOT your browser determines your surfing speed. And the only security difference is that Internet Explorer can handle ActiveX, but it asks you if you want to install them anyway.

Now I’m probably going to get a bunch of Firefox fanboys whining about how they “got 218371938 viruses” when they used IE, but I have one other complaint.

LUNUX IS NOT BETTER THAN WINDOWS. You can’t compare the two. Granted, they are both operating systems, but they’re both for different things, I’ll play games on Windows, and surf the internet on my IE with tabbed browsing. You can whack off to the mozilla firefox homepage and Linux logo. I don’t care.

You’re all just hurting yourselves."
49,2006-02-10T23:23:00+00:00,Pip,,,comment,0,"Thanks for that. I think we can all agree that Mitchell certainly gives us some food for thought there."
50,2006-02-15T13:59:00+00:00,Draken,,,comment,0,"**Firefox vs IE**  
Some options on firefox are reliable such as saving your personal passwords and settings (single users) which on IE you can’t. on firefox you can easly get pictures that is unable on IE when you use right click on your mouse. on firefox you can browse the web with mutiple tabs in one window, unlike IE where you have on open more windows draining your RAM. you can also have more opion on your favorite for quicker access on firefox.

so far firefox has lot of advantage over IE. firefox even have pop up, virus and spyware protector. basicly IE is no match for firefox, but there is one thing that IE have that firefox doesn’t. some website requires IE such as Internet Explore Windoes: Update (<http://update.microsoft.com/windows>  
update).  
*why is it important?*  
Without IE you can’t update your computer anymore, can’t detect new software for your computer needs, trying to uninstall IE would be a big mistake on your part. eventually you’ll have to reinstall IE just so you can update your PC (if you need   
<http://update.microsoft.com>). Another advantage that IE have is that some Audio player (webs player) also requires IE to play video, or simply just an audio file. (hmm….) like Yahoo music (unless firefox cover that problem up).

overall I think firefox is a great browser tool to add on your computer, as for IE just leave it on your PC because like i said before, some website requires IE. and for Linux … I have no comment on it (haven’t used or think of using it)"
51,2006-02-21T21:49:00+00:00,Onyx,,,comment,0,"I reached your blog after typing “fuck firefox” in google….. You might want to know why I am doing something like that. Well, I am currently working on a webpage and it looks great in IE but Firefox screws everything up. I worked on quite a few webpages already and I’m always having trouble with Firefox. So: Fuck Firefox! Go IE!"
52,2006-02-22T00:12:00+00:00,Pip,,,comment,0,"haha, genius! 🙂"
53,2006-03-16T04:55:00+00:00,Yank,,,comment,0,"(I got here by typing “Fuck Firefox” into google too)

“Some options on firefox are reliable such as saving your personal passwords and settings (single users) which on IE you can’t. on firefox you can easly get pictures that is unable on IE when you use right click on your mouse. on firefox you can browse the web with mutiple tabs in one window, unlike IE where you have on open more windows draining your RAM. you can also have more opion on your favorite for quicker access on firefox. “

1\. You can save personal passwords and settings on both IE6 and IE7, what are you talking about?

2\. You can save images with a simple right click on IE6 and IE7, what are you talking about?

3\. Actually tabbed browsing takes way more RAM than window browsing, but IE7 does allow for Tabbed browsing.

4\. More option on your favorite for quick access? What are you talking about? Favorites work the same way on Firefox and IE.

“Firefox even have pop up, virus and spyware protector.”

1\. I use IE7 (used to use IE6) and I havn’t gotten any form of malicious program on my computer in a year. If you’re having a problem with malicious code, get a better antivirus, like Nod32.

2\. IE7 does have a popup blocker, and if you’re running IE6 you could always get Google taskbar, which blocks popups the same way firefox blocker does.

Firefox is crap."
54,2006-04-10T11:48:00+00:00,Anonymous,,,comment,0,"I can attest to all of the comments made here. I too was bought here by googling “fuck firefox”  
I’m tired of the linux nerds and mozilla zealots promoting ridiculous propaganda on websites and now T-Shirts. Oh my giddy aunt.

“Mac’s” and “Firefox/FireFIX” aren’t as safe as people think.  
[http://www.theregister.co.uk/2005/09/19/symantec\_threat\_report/](http://www.theregister.co.uk/2005/09/19/symantec_threat_report/)  
Again, it’s the opinion rich/brand loyal that seem to ignore the facts.

If you are concerned about security…..  
Remember, “Avant Browser” is IE’s best friend!

Peace Out."
55,2006-04-29T20:28:00+00:00,batboyz,,,comment,0,"I have a friend who works at a offshore spyware company. Now that FireFox has become popular they create the same spywares for the FireFox browser as well. The problem is all software have security holes that can be exploited. Before the thing was why target FireFox when only 3% of users are using it when you can do IE and get 97% of users."
56,2006-05-07T10:56:00+00:00,dubya,,,comment,0,"Firefox is WAY overrated. It still mixes pages still has a bad joke zoom function and worst of all the beta versions were far more stable than the latest updates. The one i installed this week reminds me of the damned internet explorer on win98. I have to write this from Opera because the mighty Firefox crashed the second time today and i’ll be damned if i reboot again because of it.  
I suppose one can tell how i arrived to this page. ^"
57,2006-05-25T18:20:00+00:00,Anonymous,,,comment,0,"First of all a big thanks you and twelve thumbs up to everyone who’s posted recently with anti-bloody-firefox stuff. I too got here with “fuck firefox”, and I agree totally. Firefox sucks.

1.) Tabbed browsing, whoop-de-fucking-do. As someone has said, tabbed browsing can take MORE RAM than separate windows, and I’ve certainly never noticed any increase in speed with firefox. In fact, it is SIGNIFICANTLY SLOWER to both open and load pages. And I mean significantly.  
The other problem with tabbed browsing is closing stuff you didn’t want to. Okay, okay, I know firefox asks you first if you’ve got more than one tab, but even so, the risk is still far greater. Plus, opening different tabs is just harder and more irritating than separate windows.

2.) Downloading files. With IE it’s a simple right click, save image. With firefox it opens that bloody annoying download window thing, it’s like the web browser equivolent of the paperclip in word. I KNOW I just downloaded that image, I don’t want a separate window about it. I thought you were supposed to tab stuff anyway, not open more windows?!

3.) Anti-virus/spam/etc. Sorry, but I’ve NEVER found a single popup or bit of spam that I get with IE that I don’t get with firefox. If it does protect at all, it’s obviously not very good at it. The overriding fact is, if you have a decent firewall and anti-spyware software, as all internet capable computers should, then you don’t -need- anything in firefox.

4.) Some sites don’t work with Firefox. I should also note this is largely because of them just not being compatable, whereas firefox users actually deliberately and maliciously set up sites that don’t work with IE to try and force people to use firefox. If it was that great why force people, hmmm?

5.) So far I haven’t seen or been told of any features on firefox that you can’t get on IE, worthwhile ones anyway.

6.) The hype. EVERYONE is always bloody going on and on and on about firefox and I’m sick of it! Firefox itself isn’t any better that IE, but the thing that compounds it and makes it even worse is the way people keep saying how amazing it is."
58,2006-06-06T00:36:00+00:00,jas,,,comment,0,"heh… all i gotta say is, **FUCK** windows, and **FUCK** internet explorer… linux and firefox all the way.. maybe if windows was fucking dropped by most of the fuckheads that complain, spyware malware and all that bullshit wouldnt be a fucking problem, its when your using such an insecure piece of shit OS its obvious your going to run into problems, windows shouldnt even allow the installation of that kind of bullshit without admin permission \[temporary admin access \*hint hint: linux\*\] firefox is cool.. but its not responsible for fixing all the great FUCKUPS of windows"
59,2006-06-19T19:43:00+00:00,Anonymous,,,comment,0,"Sites which don’t work with Firefox are due to poor coding and failing to follow standards."
60,2006-07-20T07:34:00+00:00,Ex_ReVeN,,,comment,0,"I believe Firefox to be superior in the Porn Browsing department =D…

In my past experiences, I have had to remove or intercept spyware/ad’s etc with the use of third party programs to avoid my internet explorer (and not to mention the whole system) getting bogged down in a wave of unauthorised crap.

Since my move to firefox, I still use these third party programs (CCleaner etc) but I find firefox to be alot more dependable after i download and view such lurid material.

The clearing of internet history, cache, temporary files etc are all tied to one lovely little button (if you want) which allows you to easily clear most evidence of your internet behaviour on your end. Whereas Internet Explorer has THREE buttons and a significant amount of lag if youve been surfing for longer periods…3 Buttons! Who do they think I am a gymnast?

Lastly, I have never ever had a problem in Firefox with:  
1 – Change/Hijacked homepage  
2 – Extra browser buttons being added without permission  
3 – Speed (always been faster than IE)"
61,2006-07-26T06:11:00+00:00,Anonymous,,,comment,0,"My choice of interwebspersonalbrowsingtool is definately Opera in windows and mac, and Konquerer on Linux. Firefox can go eat a bag of hell."
62,2006-08-06T02:12:00+00:00,Anonymous,,,comment,0,"During my frustration…I tiped:”fuck firefox” and that’s how I gat gere to.

I just lost 50 bookmarks the 3rd time on firefox.  
Some webpages I cloud never see with firefox aswell.  
What’s up with this bookmarks ??!

I am sorry ,but fuck firefox,from now on."
63,2006-08-08T04:32:00+00:00,Sonny,,,comment,0,"So many different opinions…..  
Well here’s my 2 cents: I first moved to Firefox because of the hijacks/popups/un-wanted installs that use to happen to me. This was way before IE upgraded to include popup protection. It’s true that I need to use IE to view some sites, but apart from that i never had a problem with Firefox. Also i find it SO easy to use tabs in Firefox – just click my middle button (the scroll wheel) on a link to open it in a new tab, and click the same button on a tab to close it! How easy is that? Well, apart from the in-built ‘Google search bar'(never been a fan of installing toolbars in IE), tabbed browsing is my favourite feature in Firefox. In regard to Linux… I have tried it and i believe it is a great operating system (if you know how to use it) but i’ve never spent the time to learn it, and i can’t be bothered to find alternate applications to the ones i currently use in windows (i know about Windows emulators but….and i like to play games made for Windows OS….) So where do i stand? (now that IE is kinda fixed?) I’ll sit on the fence for a bit longer and let you guys fight it out 😉 But it’s hard to change from what you’re use to….true?"
64,2006-08-15T14:01:00+00:00,"your new",,,comment,0,"To all you IE lovers, your all fucking newbs. If a site doesn’t work in Firefox it’s because whoever made it is a dipshit ape. My grandma knows HTML better then them. Second, IE sucks at standards, try making a site with CSS that works in IE, it sucks. So fugoff."
65,2006-08-16T14:27:00+00:00,Anonymous,,,comment,0,"OK I work as an ASP.NET developer in an advertising agency. ALL of the designers here are in bed with Firefox but I’ve noticed something very interesting.

So you design a page, you use XHTML and CSS, all good so far.

In parallel universe a – everyone uses IE  
In parallel universe b – people use IE, Opera, Firefox, Safari etc.

Which parallel universe is throwing money down the drain because their designers are spending hours and hours making their CSS work on all the different browsers? b of course.

We have so many different browsers yet XHTML and CSS are supposed to be about standards, and Firefox is supposed to promote standards – I just don’t understand. Another thing – why does my site (that is valid XHTML and valid CSS) work in IE every time, and work in previous versions of Firefox… yet when Firefox get’s an update it stops working.

I’ll wager Firefox users are primarily designers testing their sites. Normal users (my Mum, my Gran, our secretary etc.) use IE.

Annoyed"
66,2006-08-16T14:36:00+00:00,Pete,,,comment,0,"I’m sure FireFux is a safer browser that IE, of that I have no doubt.

But why? Because hackers don’t waste their time on browsers no-one uses."
67,2006-08-17T15:07:00+00:00,somebody,,,comment,0,"*OK I work as an ASP.NET developer in an advertising agency. ALL of the designers here are in bed with Firefox but I’ve noticed something very interesting.*

So you design a page, you use XHTML and CSS, all good so far.

In parallel universe a – everyone uses IE  
In parallel universe b – people use IE, Opera, Firefox, Safari etc.

Which parallel universe is throwing money down the drain because their designers are spending hours and hours making their CSS work on all the different browsers? b of course.

We have so many different browsers yet XHTML and CSS are supposed to be about standards, and Firefox is supposed to promote standards – I just don’t understand. Another thing – why does my site (that is valid XHTML and valid CSS) work in IE every time, and work in previous versions of Firefox… yet when Firefox get’s an update it stops working.

I’ll wager Firefox users are primarily designers testing their sites. Normal users (my Mum, my Gran, our secretary etc.) use IE.

Annoyed

Maybe if IE followed a single standard you wouldn’t have to code “for IE” or “for Mozilla” and could just code to standards. IE’s the reason we can’t use CSS 2. IE doesn’t even support DOM 1 completely. What a POS."
68,2006-08-17T16:45:00+00:00,Anonymous,,,comment,0,"I’m confused – my point was CSS hacks are necessary for current browsers. I’ve never seen a site that looks the same in all of them.

Surely you can understand that if everyone used IE then we would only need to write one CSS?

In addition is IE the reason that all CSS sites look the same? Sorry I couldn’t help but slip that in."
69,2006-08-18T13:51:00+00:00,Anonymous,,,comment,0,"*I’m confused – my point was CSS hacks are necessary for current browsers. I’ve never seen a site that looks the same in all of them.*

Surely you can understand that if everyone used IE then we would only need to write one CSS?

In addition is IE the reason that all CSS sites look the same? Sorry I couldn’t help but slip that in.

If IE properly implemented CSS, you can bet your ass every other serious browser would. IE’s bad CSS is the reason you can’t use certain CSS constructs, which is the reason other browsers have no incentive to support them as they can’t be used anyway."
70,2006-08-18T14:03:00+00:00,Pete,,,comment,0,"The sole purpose of firefox seems to be to give smug techies something to feel good about.

“urgh – your browser doesn’t support standards, na na na na na” etc…

~85% of my end users use IE – to me that makes IE the standard web browser. Personally I’d rather create products / sites that work correctly for the largest number of people."
71,2006-08-18T14:06:00+00:00,Anonymous,,,comment,0," *The sole purpose of firefox seems to be to give smug techies something to feel good about.*

“urgh – your browser doesn’t support standards, na na na na na” etc…

~85% of my end users use IE – to me that makes IE the standard web browser. Personally I’d rather create products / sites that work correctly for the largest number of people.

I suppose you’d also rather create products that use 10-year-old technology and can’t support DOM 2, CSS 2 or 3 and many other technologies. That’s okay, at least this way you don’t have to hurt your brain learning new things."
72,2006-08-22T16:23:00+00:00,Pete,,,comment,0,"*I suppose you’d also rather create products that use 10-year-old technology and can’t support DOM 2, CSS 2 or 3 and many other technologies.*

You’d suppose incorrectly then – I’d rather adhere to standards, but frankly it’s more important to me to consider the needs of 85% of my users ahead of the remaining 15%.

*That’s okay, at least this way you don’t have to hurt your brain learning new things.*

I am assuming that as we’re getting personal, it will be ok for me to say this:

That’s okay, at least this way you don’t have to hurt your brain by managing to understand the rather basic point of my previous comments."
73,2006-09-03T14:18:00+00:00,PerpetualMotionUK,,,comment,0,"Hehe, I also got here by typing “Fuck Firefox” in Google!

You can take Firefox and its abysmal memory leakage problems as well AND SHOVE IT.

I’m tired of geeky twats trying to make Firefox out to be the best of breed when it simply isn’t. NOT EVEN CLOSE!

Firefox fanboi’s need to go [here](http://www.howtocreate.co.uk/browserSpeed.html) and weep about the terrible speed scores that Firefox achieves.

Failing that, carry on jacking off to a cartoon fox (proving you have enough memory left to display it).

NOTE:  
If you want a REAL standards compliant ACID2 browser, there is an alternative: Opera at <http://www.opera.com>

**Opera. Your Web. Your Choice**"
74,2006-10-01T19:08:00+00:00,HonestObserver,,,comment,0,"Fuck Firefox. I reformatted my computer recently, and now I have to manually instally dozens of media plugins, when the much-vaunted OMGOPENSOURCE community doesn’t do shite in automating the process. Sure, it’s partly the fault of RealNetwork, Apple, et al. for introducing so many stupid formats, but this is just retarded."
75,2006-10-13T13:49:00+00:00,Anonymous,,,comment,0,"Got here through fucking google’s fucking “fuck firefox”. You’r a fucking fuck, fanboy fuck.  
Fuck."
76,2006-10-13T16:00:00+00:00,Pip,,,comment,0,"Best comment yet, thanks!"
77,2006-11-08T08:51:00+00:00,Anonymous,,,comment,0,"I don’t think half the IE users here have even used Firefox. Are you basing things on what other people say or have you actually used Firefox for a couple of days?

Everyone who claims IE is better because with Google Toolbar and IE 7, it matches Firefox’s capabilities, read this: Who had these features first? Remind anyone of Apple vs Microsoft in the earlier days of GUI?

PS: Yes, I got here from “fuck firefox”, only because seeing ignorant fights between “linux nerds” and “ie n00bz” makes me laugh."
78,2006-11-08T19:55:00+00:00,Anonymous,,,comment,0,"Dear Onyx.  
I have one comment to your “My website doesn’t work in Firefox” speach. Fuck you you fucking retard. If you can’t code a website to that firefox will work with it then you must be the stupidest person i have replied to yet. Firefox rules and is much better than any version of Internet Explorer. There are many advantages to using firefox insted of ie but a few are PNG24’s Alpha Channel, no Memory Holes, Updated more, better W3C Complience and i could go on but I hope you get the point after this. Linux rules, why pay loads for an os when you can get a more featured os for free. When ever I let anyone use Internet Explorer on any of my computers I allways end up having to format my hdd and reinstall xp so i have dissabled it in Program Access and Defaults setup so if i need to update my os i can just enable it or run iexplore."
79,2006-11-12T23:28:00+00:00,Anonymous,,,comment,0,"A lot of vitriolic, polarised opinion here. Which is very fcuking silly considering both are almost identical pieces of software that do, bar the specfic feature sets, the exact same job.

I think we can agree that you’re all a bunch of fcuking retards."
80,2006-11-23T17:07:00+00:00,Anonymous,,,comment,0,"@Anonymous (posted on 7:55 PM, November 08, 2006)

Ok, judging from what you wrote I guess everybody will agree that YOU are the retard…..

1\. Learn to debate! I never attacked you, just your ‘beloved’ browser.   
2\. You nerd better get off your comp, go to school and learn to read! I never said it was “my website”. It was a project with certain functions that just didn’t work with FF.  
3\. Next time put your name down you whimp so that I can adress you back!

I still don’t like FF and it probably won’t change now that IE7 is out.

~ Onyx"
81,2006-12-03T04:47:00+00:00,HonestObserver,,,comment,0,"Wow. I think Phil should just go ahead and build a forum around this debate. We’ve got enough regular visitors already.

Oh, and fuck."
82,2007-02-18T10:55:00+00:00,Anonymous,,,comment,0,"Also got here with the ‘fuck firefox’ Google after a friend of mine told me about it…makes for an amusing read.

FF is a hassle. It’s a separate install, and as that speed test indicated, generally slower than IE, especially in startup. Spyware is not as prevalent as it used to be (I haven’t been hit in over a year, using generally unpatched IE6 with minimal security settings), so the security superiority of FF is negligible.

And there are still a decent number of webpages that don’t work properly with it. Why care if it’s technically the page’s fault for not adhering to web standards…the fact simply is, IE works with more pages as they were intended to be viewed than FF does. You’re not going to win over the mainstream of PC users who could care less by waging some silly stubborn crusade by continuing to use FF.

I honestly think some people use it as a form of ‘geek cred’, that they’re using as few ‘evil M$’ products as possible (since most of them probably are afraid to nuke Windows and attempt to use Linux).

“Faster. *Wrong.* Safer. *Not by much.* Better. *Than IE 2.0-maybe.*“"
83,2007-02-27T01:26:00+00:00,Anonymous,,,comment,0,"Fuck you and fuck firefox."
84,2007-03-14T15:25:00+00:00,Anonymous,,,comment,0,"I found your page by typing ‘fuck firefox’ into google.

I was mad because Firefox has been crashing lately.

As for the guy saying we can all whack off to the Lunux (sic) logo – there’s really not a logo. Linux is an operating system with many different shells. That’s why there’s more than one distribution.

As for Windows, I don’t like spending $100+ on insecure bullshit.

But I love my games. So screw Linux til I’m much much older.

And as far as the comment about INTERNET SPEED (sic) making your web browser fast – Mozilla Firefox is faster because of its updated rendering engines and page loading mechanics, thus making it faster than IE. Developers must put much time into writing pages to be IE-friendly because IE is based on very old browser architecture.

I believe I’ve made myself clear."
