"Comment ID","Timestamp GMT",Author,"Author email","Author URL",Type,Parent,Comment
1175,2007-09-10T19:46:00+00:00,Gareth,,,comment,0,"I suspect that my daughter’s plaintive cries over the sudden disappearance of all her Barbie and Polly Pocket accessories is enough to shelve any plans to invest in a Roomba any time soon."
1176,2007-09-10T23:34:00+00:00,HeyGabe,,,comment,0,"I suggest that before investing in a roomba, you consider investing in the company that makes the hideously short-lived internal filters.   
Once those babies get clogged, your little robotic vacuum friend is simply a little robotic friend.

However, I amused myself for several months by making the roomba war with my daughter’s automoton monkey."
1177,2007-09-11T03:34:00+00:00,leff,,,comment,0,"if you have 4 cats it might not make it much longer than a few months, replacement filters or no. I speak from painful firsthand experience."
1178,2007-09-12T21:10:00+00:00,Mathew,,,comment,0,"Robots should be more like [this](http://video.google.com/videoplay?docid=6642182204314801204&q=robot+kiss+w&total=5&start=0&num=10&so=0&type=search&plindex=1)"
