"Comment ID","Timestamp GMT",Author,"Author email","Author URL",Type,Parent,Comment
442,2005-05-05T21:36:00+00:00,Anonymous,,,comment,0,"If it is true then it is a fact, not a factoid."
443,2005-05-06T08:50:00+00:00,Pip,,,comment,0,"I meant it like the second meaning at [http://www.cogsci.princeton.edu/cgi-bin/webwn2.0?stage=1&amp;word=factoid](http://www.cogsci.princeton.edu/cgi-bin/webwn2.0?stage=1&word=factoid)

“a brief (usually one sentence and usually trivial) news item”

Or indeed as dictionary.com has it: “A brief, somewhat interesting fact”.

Although I accept the potential confusion, I’d never heard it used to mean anything other than what I intended. Duly noted 🙂"
