"Comment ID","Timestamp GMT",Author,"Author email","Author URL",Type,Parent,Comment
1627,2012-02-21T23:39:46+00:00,"Steve Anderson",steve@twindx.com,http://www.dailyrnail.co.uk,comment,0,"I have every episode of Octonauts (including Creature Reports and the two Christmas specials) backed up in case the BBC ever lose their copies and want to put them on iPlayer. I think I can provide a similar service for them for Timmy Time as well.

Maybe I should keep an offsite backup of this data…?"
1628,2012-02-22T18:39:01+00:00,Phil,phil@philwilson.org,http://philwilson.org,comment,0,"I should add that I have purchased two copies of the 5-disc Timmy Time pack, and the two available Octonauts DVDs.

Steve – yes, that sounds very sensible. I know a great host, I’ll email you."
1629,2012-02-24T10:01:06+00:00,Tom,tom@tomnatt.com,,comment,0,"Samurai Jack: 52 episodes, finished airing 2004, only available in Region 1 DVD release

Friendship is Magic: season 1 26 episodes, all aired by the middle of last year, all available on US iTunes, no European release at all

I find it very sad that I can’t actually give someone money in order to watch these things."
