"Comment ID","Timestamp GMT",Author,"Author email","Author URL",Type,Parent,Comment
1022,2007-01-10T17:04:00+00:00,r4kk4,,,comment,0,"oh hey!!! HAPPY BIRTHDAY, SIR PIPS A LOT!!!!! 27 isn’t that old. you’ve got three good years left! ;D

ok, i accept your five things challenge!"
1023,2007-01-10T18:35:00+00:00,Danny,,,comment,0,"Happy Birthday!!!

You speak Latin? wtf!? (very cool, in a Time Team kind of way).

Baked beans – wtf!? Can’t get ’em here (tried hacking them with borlottis in pulpa di pomodori, really not the same…), really miss them.

Phones – absolutely.

No drafts – good plan."
1024,2007-01-10T19:56:00+00:00,leff,,,comment,0,"Happy Birthday Pippers! 27!?! You are as yet a mere babe. A youngin as it’s called in the lands across the sea.

(sorry, reading tolkien. can you tell?)"
1025,2007-01-11T06:54:00+00:00,Kate,,,comment,0,"Happy Birthday. Cool meme. Not too many people I know speak Latin. Have a great year ahead.  
Check out [ my blog](http://gifts4birthday.blogspot.com) for some cool birthday gift and party ideas."
1026,2007-01-12T12:48:00+00:00,"Irregular Shed",,,comment,0,"I’ve done my part, in case you haven’t seen it already.

[Link-me-do](http://www.twindx.com/node/212)"
1027,2007-01-13T00:18:00+00:00,Pip,,,comment,0,"thanks everyone, what’s great about your reassurances is that unless you all go into cryogenic stasis, you’ll be able to do it all over again next year too! woohoo!

danny, mail me your address and I’ll post you some 🙂"
